index,topic,label,length,sentiment,content
943,Undefined,1,86,negative,"Says Kaleb Torres, a young spokesperson for Shriners Hospitals for Children, has died."
944,Undefined,1,150,negative,"Says Joe Biden and Barack Obama 'directly participated in a plot to have #SealTeam6 MURDERED, then arranged a massive cash deal as part of a cover up."
945,Undefined,1,131,neutral,'Manufacturing the battery for one electric car produces the same amount of carbon dioxide as running a petrol car for eight years.
946,Undefined,1,79,neutral,"Says there are fewer than 2,000 confirmed COVID-19 hospitalizations in the U.S."
947,Undefined,1,131,negative,Contractors hired by government officials to frame Donald Trump are 'behind the fake news in mainstream media' and recent protests.
948,Undefined,1,127,negative,"The longest filibuster in U.S. history was 75 days and 'took place in 1964, when Democrats tried to block the Civil Rights Act."
949,Undefined,1,98,neutral,'The WORLD HEALTH ORGANIZATION recently reversed its stance on children getting the Covid vaccine.
950,Undefined,1,140,negative,The media 'pulled down an entire shelf of goods so that they can present the news of people buying stuff in a hysteria over the coronavirus.
951,Undefined,1,108,neutral,Says Nabisco is closing plants in Georgia and New Jersey and 'moving to Mexico' because of Biden's election.
952,Undefined,1,48,positive,"'If you like your private plan, you can keep it."
953,Undefined,1,56,negative,A photo shows Rob Cantrall at a recent Michigan protest.
954,Undefined,1,100,negative,'BLM Activist kills three people in a Louisville bar wearing a Breonna Taylor tee shirt last Friday.
955,Undefined,1,157,negative,The premier of Australia's Victoria state 'is freezing people's bank accts' if they are not vaccinated. 'They can't buy or sell until forced into submission.
956,Undefined,1,49,neutral,Says 'we will know which candidate you voted for.
957,Undefined,1,87,negative,Says Republican leaders 'are working hard to cover up election corruption in Wisconsin.
958,Undefined,1,114,negative,"Navy SEALs found over 1,000 trafficked children and dead bodies on the Evergreen ship that blocked the Suez Canal."
959,Undefined,1,116,negative,'NYT is correcting their lies..Trump paid $1M in 2016 & $3.8M in 2017-18..THEY LIED..AGAIN. INFO ON TWITTER THIS AM.
960,Undefined,1,172,positive,"'If the president had done his job, had done his job from the beginning, all the people would still be alive. All the people. I'm not making this up. Just look at the data."
961,Undefined,1,50,neutral,Nancy Pelosi is no longer the Speaker of the House
962,Undefined,1,43,neutral,'Dr. Fauci: No reason to be wearing a mask.
963,Undefined,1,185,negative,Says 'showing up at the front doors of people's houses and violating HIPAA laws by requesting private medical information regarding their vaccination status is unacceptable and illegal.
964,Undefined,1,117,neutral,The Biden White House has 'no one there. They don't travel. They don't go down to the border. They don't go overseas.
965,Undefined,1,41,neutral,'Boom! Georgia 1st to decertify election.
966,Undefined,1,56,negative,'Voter FRAUD exposed in Georgia. Over 2600 votes 'FOUND.
967,Undefined,1,69,negative,Photo shows Time magazine cover with Barack Obama that says 'Treason.
968,Undefined,1,101,neutral,"'If you make $50,000/year, $36 of your taxes goes to food stamps. $4,000 goes to corporate subsidies."
969,Undefined,1,62,positive,'They didn't allow' Simone Biles 'to take her ADHD medication.
970,Undefined,1,117,negative,The chaos at the Kabul airport as the Taliban took over Afghanistan's capital was a 'false flag event to provoke WW3.
971,Undefined,1,204,positive,"'Putting a national lockdown, stay-at-home orders, is like house arrest. Other than slavery, which was a different kind of restraint, this is the greatest intrusion on civil liberties in American history."
972,Undefined,1,63,neutral,Says 'Hugo Chavez's family still owns' Dominion Voting Systems.
973,Undefined,1,48,neutral,Says a video shows Joe Biden lolling his tongue.
974,Undefined,1,64,negative,'Israel dropped a tactical nuclear weapon on the port of Beirut.
975,Undefined,1,162,positive,'Alert: Law enforcement and the Red Cross have advised that there are people going door to door indicating that they are authorized to do testing for Coronavirus.
976,Undefined,1,135,negative,An 'audit report' found that a voting system used in Michigan in the 2020 presidential election was designed to 'create systemic fraud.
977,Undefined,1,115,neutral,A video shows 'your packages were rerouted and have arrived in the port of Miami' as a result of Gov. Ron DeSantis.
978,Undefined,1,30,neutral,Photos show children in cages.
979,Undefined,1,104,negative,A photo shows Gov. Gretchen Whitmer 'on Mackinaw Island today ignoring mask and social distancing rules.
980,Undefined,1,165,negative,"'If you look at the one (hydroxychloroquine) survey, the only bad survey, they were giving it to people that were in very bad shape. They were very old. Almost dead."
981,Undefined,1,91,negative,"Media outlets reported that the same boy died 3 times from the coronavirus, in 3 countries."
982,Undefined,1,106,negative,A graph shows the number of human trafficking arrests increased dramatically under President Donald Trump.
983,Undefined,1,160,neutral,California voters who go to the polls to vote in person will be 'TURNED AWAY & CANNOT VOTE' unless they change their voting preference to 'NO to mail in voting.
984,Undefined,1,182,negative,'Hoadley called women 'breeders.'... wanted to learn about crystal meth and wrote that his sexual partners were his victims. Hoadley even wrote about a four year-old wearing a thong.
985,Undefined,1,105,neutral,A Dominion representative in Gwinnett County improperly downloaded election data to 'manipulate the data.
986,Undefined,1,87,negative,Says Kamala Harris called Joe Biden 'a racist' during a Democratic presidential debate.
987,Undefined,1,45,neutral,"'The blood test for coronavirus costs $3,200."
988,Undefined,1,144,negative,Says it doesn't make sense for young adults to get the vaccine since they 'really are not under that much of a threat as a result of this virus.
989,Undefined,1,73,positive,Says Listerine mouthwash can be effectively used as a mosquito repellant.
990,Undefined,1,104,negative,"Under an 1866 Supreme Court ruling, stay-at-home orders are illegal and can be disregarded with impunity"
991,Undefined,1,51,neutral,"'Trump bailed out Wall Street, but not Main Street."
992,Undefined,1,97,negative,Video shows California election workers 'cheating' by collecting ballots from drop box on Nov. 4.
993,Undefined,1,73,positive,A 'face mask exempt card' allows you to cite the ADA and not wear a mask.
994,Undefined,1,90,neutral,"In the infrastructure bill that just passed the House, 'only 10% is actual infrastructure."
995,Undefined,1,246,negative,"Quotes Ronald Reagan as saying, 'Keep voting Democrat ... One day they will restrict your freedoms, restrict your history and restrict your safety. All in the name of professional victims that don't understand the consequences of their ignorance."
996,Undefined,1,74,negative,'Biden orders dishonorable discharge for 46% of troops who refuse vaccine.
997,Undefined,1,65,neutral,Says 'Joe Biden is absolutely on board with defunding the police.
998,Undefined,1,96,negative,Says the coronavirus isn't new because 'Lysol has it listed as one of the viruses that it kills.
999,Undefined,1,174,negative,"'And I heard that just yesterday, Joe Biden said that well-armed police in his words 'become the enemy' and he said that he would 'absolutely cut funding for law enforcement."
1000,Undefined,1,173,negative,"With the goal to preserve 30% of the earth's land and water by 2030, '300 million people stand to lose their land and livelihood, most of them tribal and indigenous peoples."
1001,Undefined,1,146,positive,'Pfizer and Moderna could share their design with dozens of other pharma companies who stand ready to produce their vaccines and end the pandemic.
1002,Undefined,1,99,negative,"'While voters were distracted, (Gov. J.B.) Pritzker gave huge pay raises to his politician buddies."
1003,Undefined,1,85,neutral,Photo shows Barack Obama and George Clooney in a compromising situation with a child.
1004,Undefined,1,140,neutral,Nazi Germany's Hermann Göring worked to 'defund and eliminate the police departments so that they would not interfere with his Brown Shirts.
1005,Undefined,1,185,positive,"Says a photo shows an ambushed Los Angeles police officer and that the NFL intends to 'honor and praise the organization' that stood outside of the hospital chanting, 'We hope she dies."
1006,Undefined,1,81,positive,'Rocks being dropped off in cages in LA for rioters. Compliments of George Soros.
1007,Undefined,1,77,positive,Says he was the first person to call for invoking the Defense Production Act.
1008,Undefined,1,129,negative,A TikTok video is correct in saying Belgium's solar-powered parking meters are frequently unusable because of a lack of sunlight.
1009,Undefined,1,214,negative,"Government officials, law enforcement, billionaires, or antifa groups nefariously placed pallets of bricks at protest sites in U.S. cities to stoke violence during June 2020 demonstrations against police brutality."
1010,Undefined,1,68,neutral,A video shows a piece of 5G equipment with 'COV-19' inscribed on it.
1011,Undefined,1,87,neutral,Donald Trump will be a 'part-time President' and keep his job on 'Celebrity Apprentice.
1012,Undefined,1,258,negative,"A gunman associated with the Black Lives Matter (BLM) movement shot and wounded two Los Angeles County sheriff's deputies on Sept. 12, 2020, and BLM protesters afterwards blocked emergency access to the hospital where the deputies received medical treatment."
1013,Undefined,1,153,positive,U.S. President-elect Joe Biden created the 'Office of the President Elect' to convince Americans the 2020 elections results were final when they weren't.
1014,Undefined,1,128,negative,"In June 2016, Michigan residents lost the 'right to farm,' keep chickens, or maintain bee hives due to a change in existing law."
1015,Undefined,1,85,neutral,U.S. Rep. Alexandria Ocasio-Cortez was married with a husband in early February 2021.
1016,Undefined,1,79,neutral,A photograph shows a baseball stadium repurposed as a residential neighborhood.
1017,Undefined,1,117,neutral,Former U.S. President Donald Trump's tax return documents revealed that he claimed U.S. Sen. Ted Cruz as a dependent.
1018,Undefined,1,128,neutral,There are no TV commercials for COVID-19 vaccines in the U.S. because they would be required to list the vaccines' side effects.
1019,Undefined,1,146,negative,"After being fed a spoiled shrimp, an upset octopus escaped from its aquarium, walked down a hallway, then threw the spoiled shrimp at its handler."
1020,Undefined,1,85,negative,Donald Trump once said 'I never understood why people like dogs. Dogs are disgusting.
1021,Undefined,1,131,positive,The Trump administration's approval of the presidential transition process means Trump has conceded the 2020 election to Joe Biden.
1022,Undefined,1,77,neutral,Myanmar's 2020 election used Dominion Voting Systems and Smartmatic software.
1023,Undefined,1,186,positive,"Derek Chauvin, whom news reports identified as the cop who kneeled on the neck of George Floyd before he died, was honored for his service by U.S. President Donald Trump at a 2019 rally."
1024,Undefined,1,273,positive,"The COVID-19 Testing, Reaching, And Contacting Everyone (TRACE) Act, or H.R. 6666, would authorize federally administered COVID-19 testing groups to enter American homes and force testing against residents' will, and then 'take' those who test positive to quarantine sites."
1025,Undefined,1,58,neutral,Giant pythons were discovered in a small creek in Indiana.
1026,Undefined,1,87,negative,U.S. President Barack Obama ordered the CIA to train and/or arm Islamic State fighters.
1027,Undefined,1,102,negative,Hillary Clinton said several insulting things about Michelle Obama in a leaked 20 October 2016 e-mail.
1028,Undefined,1,150,negative,"Video surveillance footage shows poll workers at Atlanta's State Farm Arena using suitcases to hide ballots from Republican observers on Nov. 3, 2020."
1029,Undefined,1,97,negative,"Kroger banned its employees from wearing American flag masks, but allowed them to wear BLM masks."
1030,Undefined,1,87,neutral,The COVID-19 pandemic was planned by the Rockefeller Foundation in 'Operation Lockstep.
1031,Undefined,1,278,positive,Data displayed on the World Bank's World Integrated Trade Solution (WITS) website in September 2020 proved that dozens of nations imported or exported items labeled 'COVID-19 Test Kits' in 2018 - more than a year before the pandemic occurred and before COVID-19 even had a name.
1032,Undefined,1,88,positive,"Fisher Price sells a 'happy hour playset' including a bar, bar stools, and beer bottles."
1033,Undefined,1,58,negative,Joe Biden is wanted in Ukraine on 'Class A felony charges.
1034,Undefined,1,68,neutral,Marjorie Taylor Greene appeared on 'The Oprah Winfrey Show' in 1997.
1035,Undefined,1,95,neutral,"An animated image shows Mount Vesuvius erupting during a firework celebration in Naples, Italy."
1036,Undefined,1,57,negative,A husband used a drone to catch his cheating wife at CVS.
1037,Undefined,1,68,positive,Donald Trump said his favorite song was 'Iris' by the Goo Goo Dolls.
1038,Undefined,1,103,positive,Alexandria Ocasio-Cortez is an actress playing a congresswoman to push the agenda of Justice Democrats.
1039,Undefined,1,114,neutral,Walt Disney put a clause in his will requiring that the Walt Disney company remake classic movies every ten years.
1040,Undefined,1,83,positive,All businesses in the U.S. are required to accept coins and/or currency as payment.
1041,Undefined,1,117,positive,"On March 31, 2021, first lady Jill Biden stood in front of a Nazi-inspired flag while giving a speech to farmworkers."
1042,Undefined,1,247,negative,"A Facebook post is correct in saying N95 masks, surgical masks, and cloth masks can be dangerous and/or ineffective in protecting against the spread of COVID-19 based on CDC and U.S. Occupational Safety and Health Administration (OSHA) guidelines."
1043,Undefined,1,64,neutral,A photograph shows a child smoking a cigarette at a soccer game.
1044,Undefined,1,72,neutral,The medical term 'vagina' has been replaced with the phrase 'front hole.
1045,Undefined,1,87,positive,Lyft and Uber are offering free rides to impaired drivers on St. Patrick's Day in 2021.
1046,Undefined,0,103,positive,Red Bull released an advertisement in October 2019 in support of pro-democracy protesters in Hong Kong.
1047,Undefined,0,136,negative,"In a 1990 episode, 'The Simpsons' predicted future real-life campaigns to censor and cover up replicas of Michelangelo's 'David' statue."
1048,Undefined,0,145,negative,Bahamians fleeing the destruction of Hurricane Dorian in late summer 2019 were forced to leave a boat to the U.S. because they didn't have visas.
1049,Undefined,0,156,positive,"In the 1960s, NASA rejected Hillary Clinton's childhood dream of becoming an astronaut because the space agency did not accept women astronauts at the time."
1050,Undefined,0,64,negative,Police shootings kill more white Americans than Black Americans.
1051,Undefined,0,64,neutral,A video shows a Muslim man kicking a woman down a set of stairs.
1052,Undefined,0,197,positive,"If 2020 Democratic candidate Joe Biden wins the presidential election in November, he would end suspensions on specific work visas, like the H-1B and J-1 visas, imposed by the Trump administration."
1053,Undefined,0,129,positive,"In May 2018, Oklahoma gubernatorial candidate Christopher Barnett advocated euthanasia for disabled people and those on benefits."
1054,Undefined,0,133,negative,A step-dad refused to pay for his daughter's wedding at the last minute because she allowed her biological father back into her life.
1055,Undefined,0,55,negative,Atheists are trying to ban Bibles from all hotel rooms.
1056,Undefined,0,89,positive,Devin Nunes' financial wealth is invested in a wine company with 'strong ties' to Russia.
1057,Undefined,0,137,negative,"Donald Trump once said: 'You never blame yourself; you have to blame something else. If you do something bad, never, ever blame yourself."
1058,Undefined,0,84,positive,HR 1313 would allow employers to force workers to disclose their genetic information
1059,Undefined,0,114,negative,'The Simpsons' television show predicted the 2020 COVID-19 pandemic and 'murder wasp' incursion in a 1993 episode.
1060,Undefined,0,143,positive,"After Hillary Clinton refused to participate in a final debate, GOP candidate Donald Trump agreed to debate Democrat challenger Bernie Sanders."
1061,Undefined,0,126,negative,Pizza Hut pressured employees in Florida to return to work 'within 72 hours' if they evacuated because of tropical storm Irma.
1062,Undefined,0,167,neutral,"At an Arizona town hall event, Sen. Jeff Flake told constituents 'we can't rely on solar power because we can't tell people they will not have lights during the night."
1063,Undefined,0,129,positive,"Reusing, freezing, or warming plastic water bottles will cause them to break down into carcinogenic compounds or release dioxins."
1064,Undefined,0,68,neutral,Viral videos shows Ferrero Rocher chocolates crawling with maggots .
1065,Undefined,0,104,positive,Donald Trump has paid up to eight sexual partners to obtain abortions and sign nondisclosure agreements.
1066,Undefined,0,299,positive,FBI agent Peter Strzok II grew up in Iran; had a father who engaged in clandestine activities overseas under the guise of doing charitable work; served as a 'Middle East intel operative' in the Obama administration; and was a CIA agent 'placed' in the FBI to help Hillary Clinton win the presidency.
1067,Undefined,0,121,neutral,"Bill O'Reily hired 'university grad students' to conduct a phone survey of 25,000 people about the presidential election."
1068,Undefined,0,111,negative,Ramsey Orta went to jail for filming the fatal encounter between Eric Garner and New York City police officers.
1069,Undefined,0,91,neutral,John Kasich said he won elections because women came out of their kitchens to vote for him.
1070,Undefined,0,131,negative,Freelance reporter Hal Lundgren wrote a letter to Lebron James criticizing the NBA star for comments he made about President Trump.
1071,Undefined,0,68,neutral,Mike Pence's parents operated a chain of 'whites only' gas stations.
1072,Undefined,0,85,negative,Both Robert E. Lee and Jefferson Davis disavowed the Confederacy after the Civil War.
1073,Undefined,0,116,positive,"A photograph shows Frank 'Rocky' Fiegel, a real-life person who served as the inspiration for the character 'Popeye."
1074,Undefined,0,152,negative,"After the 26 July 2016 roll call vote at the Democratic National Convention, hundreds of empty seats appeared to have been vacated by a planned protest."
1075,Undefined,0,108,neutral,"In 2017 and 2018, teenage boys widely purchased and used a urethra-covering adhesive band called the Jiftip."
1076,Undefined,0,116,negative,"In August 2017, the Texas House of Representatives passed a bill that would force women to purchase 'rape insurance."
1077,Undefined,0,103,positive,U.S. border officials are now searching the cellphones of Canadian citizens entering the United States.
1078,Undefined,0,62,positive,The Obama transition team kept a list of Muslims for top jobs.
1079,Undefined,0,109,positive,NASA will hire someone (with a secret security clearance) to ensure alien life doesn't make its way to Earth.
1080,Undefined,0,97,positive,Photographs show sign-bearing Muslim protesters at a 'Religion of Peace' demonstration in London.
1081,Undefined,0,111,positive,A physician once placed dying patients upon a scale and determined the weight of the human soul to be 21 grams.
1082,Undefined,0,165,negative,"In 2018, President Donald Trump began a policy of forcing detained immigrants scheduled for criminal prosecution to wear identifying wristbands and yellow bracelets."
1083,Undefined,0,67,negative,ISIS called for the assassination of Barron Trump in November 2017.
1084,Undefined,0,99,negative,A 9-year-old boy suffered burns to his feet after the light-up soles on his Skechers shoes got wet.
1085,Undefined,0,95,neutral,"In a December 2020 television episode, Nigella Lawson wildly mispronounced the word 'microwave."
1086,Undefined,0,65,neutral,Iran recently passed a law allowing men to marry their daughters.
1087,Undefined,0,75,neutral,U.S. President Joe Biden farted while meeting with the Duchess of Cornwall.
1088,Undefined,0,88,negative,Donald Trump's father was arrested following a Ku Klux Klan-related altercation in 1927.
1089,Undefined,0,75,neutral,Photographs show a new joystick-controlled Mercedes-Benz SCL600 automobile.
1090,Undefined,0,92,negative,Hillary Clinton proposed assassinating Julian Assange via drone strike to silence WikiLeaks.
1091,Undefined,0,83,positive,The California Republican Party set up unauthorized drop-boxes for mail-in ballots.
1092,Undefined,0,176,neutral,Van Halen's standard performance contract contained a provision calling for them to be provided backstage with a bowl of M&Ms from which all the brown candies had been removed.
1093,Undefined,0,128,negative,The Republican tax reform plan would increase the tax burden on graduate students by counting waived tuition as personal income.
1094,Undefined,0,168,positive,"In August 2017, Richard Robert Rawling was indicted for 'skewing vote tallies' in favor of Donald Trump and other Republican candidates during the March 2016 primaries."
1095,Undefined,0,192,positive,"Cesar Sayoc, the man accused of mailing bombs to prominent Democratic lawmakers and media organizations critical of President Trump, used to be a stripper and was 'long known to support Obama."
1096,Undefined,0,106,negative,A police officer told an African-American driver that weapons were drawn on him because 'you're not white.
1097,Undefined,0,137,positive,A Puerto Rico police officer has revealed that San Juan's mayor is sabotaging relief efforts to reflect poorly on President Donald Trump.
1098,Undefined,0,103,positive,"The day after Thanksgiving in the United States, Black Friday, is the biggest shopping day of the year."
1099,Undefined,0,87,negative,A half dozen Trump-related entities were under criminal investigation in December 2018.
1100,Undefined,0,79,neutral,Trump referred to white nationalist marchers as 'us' during a press conference.
1101,Undefined,0,96,negative,Researchers in Cuba have discovered a cancer vaccine that is already saving thousands of people.
1102,Undefined,0,93,negative,A baby was thrown from Grenfell Tower while it was on fire and caught by an unidentified man.
1103,Undefined,0,64,negative,Drug-laced suckers are being handed out to children in Arkansas.
1104,Undefined,0,114,negative,A video shows a mother forcibly shaving her daughter's head as punishment for making fun of a bald cancer patient.
1105,Undefined,0,72,neutral,A viral video shows bugs inside of a can of Chef Boyardee Mini Raviolis.
1106,Undefined,0,145,positive,Children born to U.S. service members and government employees overseas will no longer be automatically considered citizens of the United States.
1107,Undefined,0,215,positive,"Vice presidential nominee Kamala Harris had an extramarital affair with former San Francisco Mayor and State Assembly Speaker Willie Brown, who gave her two political appointments that launched her political career."
1108,Undefined,0,86,negative,Donald Trump supporters made racist comments over CB radios during a pro-Trump parade.
1109,Undefined,0,185,positive,"On Jan. 6, 2021, Trump and his closest associates held a private tent party near the U.S. Capitol to livestream footage of supporters breaking into and vandalizing the federal building."
1110,Undefined,0,79,positive,"A man in Point Pleasant, West Virginia, caught the legendary Mothman on camera."
1111,Undefined,0,74,neutral,President Trump is planning a military parade for the 4th of July in 2019.
1112,Undefined,0,130,negative,"In 2019, trans activists or 'the transgender lobby' forced Procter & Gamble to remove the Venus symbol from menstruation products."
1113,Undefined,0,63,neutral,No celebrities are willing to perform for Trump's inauguration.
1114,Undefined,0,141,negative,Dutch restaurants solved the problem of dining out during the COVID-19 coronavirus disease pandemic by installing personal greenhouse booths.
1115,Undefined,0,70,neutral,The U.S. listed the fictional country of Wakanda as a trading partner.
1116,Undefined,0,116,negative,"Japan announced plans to dump 920,000 tons of nuclear waste from the Fukushima Nuclear Plant into the Pacific Ocean."
1117,Undefined,0,70,neutral,The COVID-19 coronavirus disease is 'spreading quickly from gas pumps.
1118,Undefined,0,177,negative,"Teenagers are participating in a dangerous new internet craze known as the 'No Lackin Challenge,' and two teenagers was shot in the head during an instance of the fad gone awry."
1119,Undefined,0,131,negative,A woman developed necrotizing fasciitis (a disease described as 'flesh-eating bacteria') due to poor water quality at Myrtle Beach.
1120,Undefined,0,138,negative,"In September 2017, a Cheesecake Factory customer in California received a check that presented misleading and exaggerated tip suggestions."
1121,Undefined,0,133,positive,"U.S. President-elect Joe Biden's hat answers Donald Trump's campaign slogan 'Make America Great Again' with the phrase, 'We Just Did."
1122,Undefined,0,116,positive,The #WalkAway Campaign used ads featuring stock photograph models and claimed they were Democrats leaving the party.
