index,topic,label,length,sentiment,content
0,Undefined,0,98,neutral,"Most canned pumpkin isn't actually pumpkin, but a mixture of other squashes (including butternut)."
1,Undefined,0,121,negative,"An elementary school in Fresno, California, forced a third-grader to remove a cap bearing Donald Trump's campaign slogan."
2,Undefined,0,79,positive,A resident of East Texas shared his opinion of the Black Lives Matter movement.
3,Undefined,0,98,positive,Budweiser is giving away a free beer to people who can prove they are vaccinated against COVID-19.
4,Undefined,0,97,negative,Joshua Wilkerson was murdered by an immigrant who was staying in the U.S. due to the DACA policy.
5,Undefined,0,95,neutral,A video shows worms found by a consumer inside the candy wrappers of Ferrero Rocher chocolates.
6,Undefined,0,110,positive,President Obama banned Christmas trees and the phrase 'Merry Christmas' from Veterans Affairs (VA) facilities.
7,Undefined,0,291,negative,"Regarding what he would do if he disagreed with Vice President-elect Kamala Harris, U.S. President-elect Joe Biden said: 'Like I told Barack, if I reach something where there's a fundamental disagreement we have based on a moral principle, I'll develop some disease and say I have to resign."
8,Undefined,0,100,negative,"Indiana Jones, portrayed by Harrison Ford, once defeated a group of villains by playing a saxophone."
9,Undefined,0,174,positive,"In late August 2021, a rogue team of U.S. veterans banded together to go behind President Joe Biden's back and rescue Afghan allies in an operation dubbed 'Pineapple Express."
10,Undefined,0,92,negative,Nathan Phillips falsely claimed to be a U.S. military veteran who served in the Vietnam War.
11,Undefined,0,88,neutral,President Joe Biden said that minorities don't know how to register online for vaccines.
12,Undefined,0,95,negative,"UPS lost a family's $846,000 inheritance check but would only refund them the $32 shipping fee."
13,Undefined,0,195,neutral,"An optical illusion allows a 3D arrow to appear as if it is always pointing in the same direction (with its mirror reflection showing the opposite direction), even when it is rotated 180 degrees."
14,Undefined,0,120,neutral,A photograph shows U.S. President Joe Biden with several children wearing memorabilia for former President Donald Trump.
15,Undefined,0,62,negative,Warmer weather will inhibit the spread of the new coronavirus.
16,Undefined,0,117,negative,Donald Trump mentioned 'seven eleven' rather than 'nine eleven' when referring to the September 11 terrorist attacks.
17,Undefined,0,79,neutral,A photograph shows a man on a beach near a mountain that resembles his outline.
18,Undefined,0,107,positive,U.S. President Bill Clinton launched an airstrike on Iraq amid impeachment proceedings against him in 1998.
19,Undefined,0,134,positive,The Trump administration made immigrants pay $800 for DNA tests in order to get back children taken under its 'zero tolerance' policy.
20,Undefined,0,80,neutral,A list dispels 'falsehoods and inaccuracies of Confederate and Southern history.
21,Undefined,0,134,neutral,"In mid-September 2021, the National Health Service in England announced the world's first trial for a new cancer-detecting blood test."
22,Undefined,0,86,negative,A woman narrowly escaped an abduction attempt at the Coon Rapids Walmart in Minnesota.
23,Undefined,0,65,neutral,Putting a Ziplock bag over a car mirror has a legitimate purpose.
24,Undefined,0,107,neutral,"There is a secret card hidden in the 'Bigger, Blacker Box' edition of the Cards Against Humanity card game."
25,Undefined,0,92,positive,"Google donated $500,000 to the Black Lives Matter organization to fund an 'anti-police' app."
26,Undefined,0,160,negative,"There was a giant mass shooting at Bunny Friend Playground in New Orleans on 22 November 2015, but the media ignored the incident because the suspect was black."
27,Undefined,0,96,negative,Senator Richard Blumenthal misrepresented his record of military service during the Vietnam War.
28,Undefined,0,104,negative,"A photograph shows Rudy Giuliani with Jake Angeli, who took part in the U.S. Capitol riot wearing horns."
29,Undefined,0,64,negative,President Trump has called for the death penalty for pedophiles.
30,Undefined,0,102,positive,In May 2017 President Trump launched a monthly 'Big League Box' subscription for campaign merchandise.
31,Undefined,0,103,neutral,Fox News host Tucker Carlson was listed as a member of the 'Dan White Society' in his college yearbook.
32,Undefined,0,134,negative,"The image depicts a leaked 'White House catering' sheet requiring Mountain Dew, Hungry Man dinners, and framed Electoral College maps."
33,Undefined,0,144,positive,"In early 2021, the Biden administration was 'recklessly releasing' hundreds of migrants who tested positive for COVID-19 into Texas communities."
34,Undefined,0,61,neutral,Manatees regulate their in-water buoyancy through flatulence.
35,Undefined,0,220,negative,"A Black man was charged in North Carolina in the killing of Cannon Hinnant, a 5-year-old white boy, and except for Fox News, mainstream news media outlets purposely ignored it to further a predetermined racial narrative."
36,Undefined,0,75,neutral,A photograph shows a long line of climbers waiting to ascend Mount Everest.
37,Undefined,0,69,neutral,A photograph of breast milk under a microscope appears glittery gold.
38,Undefined,0,89,negative,The Tim Allen show 'Last Man Standing' was cancelled due to the star's political beliefs.
39,Undefined,0,102,neutral,President Donald Trump was using an anti-Semitic slur when he called NBC host Chuck Todd 'sleepy eyes.
40,Undefined,0,107,positive,Sen. Ted Cruz's campaign has sent fundraising letters with an envelope made up to resemble a legal summons.
41,Undefined,0,74,negative,A couple sued Planned Parenthood for child support over a failed abortion.
42,Undefined,0,58,neutral,A NASA photograph shoes actual blue-colored dunes on Mars.
43,Undefined,0,136,neutral,The reservoir of Three Gorges Dam in China can retain an amount of water voluminous enough to slow and change the rotation of the Earth.
44,Undefined,0,122,negative,"Donald Trump 'bankrupted' a golf course in Puerto Rico, leaving taxpayers there on the hook for $33 million worth of debt."
45,Undefined,0,95,negative,A Facebook message requesting Christmas cards for 8-year-old burn victim Safyre Terry is legit.
46,Undefined,0,81,neutral,"Coverage under Obamacare can costs more than $1,200 a month for a family of four."
47,Undefined,0,197,neutral,"Patients can circumvent insurance company claim denials by requesting a specific form of documentation, as the insurance company will opt to simply cover the cost rather than provide the paperwork."
48,Undefined,0,78,negative,Attorney General Jeff Sessions has investments in the private prison industry.
49,Undefined,0,74,negative,A video shows two people waving guns at protesters in front of their home.
50,Undefined,0,115,neutral,"Hillary Clinton's first name was spelled 'Hilliary' on election ballots printed for use in Lonoke County, Arkansas."
51,Undefined,0,109,negative,First Lady Melania Trump again copied words from Michelle Obama while denouncing violence in Charlottesville.
52,Undefined,0,111,positive,The phone number 1-866-211-9966 connects callers with the United Way's COVID-19 Community Economic Relief Fund.
53,Undefined,0,161,positive,The volume of Americans researching the details of immigrating to Canada was so high on Super Tuesday that it temporarily crashed the country's immigration site.
54,Undefined,0,94,negative,University of Missouri (Mizzou) hunger strike participant Jonathan Butler is secretly wealthy.
55,Undefined,0,101,negative,A prankster changed the name of Trump Tower to Dump Tower in Google Maps briefly on 26 November 2016.
56,Undefined,0,87,neutral,A 17-year-old girl named Alyssa Carson is being trained by NASA to become an astronaut.
57,Undefined,0,199,positive,"David Hogg stated that he believes that the enforced use of clear backpacks in school constitutes a violation of students' First Amendment rights, but he favors the abolition of the Second Amendment."
58,Undefined,0,165,positive,The Justice Department offered Hillary Clinton a plea deal in mid-2017 after reopening an investigation into her handling of classified material on a private server.
59,Undefined,0,58,neutral,Cheap soy sauce is made from the hair of Chinese convicts.
60,Undefined,0,100,positive,Foam 'Squishies' toys have been determined to contain toxic materials and were recalled as a result.
61,Undefined,0,96,positive,"Eric Trump declared that his father, U.S. President Donald Trump, 'literally saved Christianity."
62,Undefined,0,106,negative,Socialist teachers at South Charlotte Middle School put the message 'Fuck Kavanaugh' on the school's sign.
63,Undefined,0,86,neutral,A photograph shows two children holding a 'F*CK Donald Trump' sign at a Chicago rally.
64,Undefined,0,98,neutral,A study proved e-cigarette use (or vaping) leads to an incurable condition known as 'popcorn lung.
65,Undefined,0,61,negative,A woman in Oklahoma was killed by a pack of small dachshunds.
66,Undefined,0,136,neutral,NAIAD director Dr. Anthony Fauci warned in January 2017 that the Trump administration would face a surprise infectious disease outbreak.
67,Undefined,0,105,negative,An old image of truck driver Reginald Denny advocates that drivers not stop for road-blocking protesters.
68,Undefined,0,96,neutral,An image shows that Democratic interns are much more diverse as a group than Republican interns.
69,Undefined,0,147,negative,Two British teens who killed a child when they were ten years were granted anonymity for life by the courts and released from custody in June 2001.
70,Undefined,0,90,negative,Memorial Day began with a May 1865 ceremony held by former slaves to honor Union war dead.
71,Undefined,0,79,neutral,Editorial by pianist Huntley Brown explains why he won't vote for Barack Obama.
72,Undefined,0,64,negative,Photograph shows a dog injured by fireworks placed in its mouth.
73,Undefined,0,69,neutral,Photograph shows golfers fleeing from the approach of a grizzly bear.
74,Undefined,0,168,positive,Implementation of Dream Act guidelines will grant amnesty to illegal aliens residing in the United States if they agree to enlist in the U.S. military or enter college.
75,Undefined,0,78,neutral,A virus deadly to dogs has been spreading in the canine population of the U.S.
76,Undefined,0,103,negative,Nike pulled a print ad for their Air Dri-Goat shoes because readers found it offensive to the disabled.
77,Undefined,0,117,negative,Donald Trump mentioned 'seven eleven' rather than 'nine eleven' when referring to the September 11 terrorist attacks.
78,Undefined,0,66,neutral,Wal-Mart is trying out products embedded with RFID tracking chips.
79,Undefined,0,70,positive,Barack Obama's net worth increased over $10 million from 2008 to 2012.
80,Undefined,0,66,positive,Star Trek creator Gene Roddenberry survived a plane crash in 1947.
81,Undefined,0,94,positive,An army captain in Iraq describes President Bush's surprise Thanksgiving Day visit to Baghdad.
82,Undefined,0,86,positive,Message lists consequences that will result from passage of the Freedom of Choice Act.
83,Undefined,0,91,neutral,President Bush prayed with an injured Special Forces soldier at Walter Reed Medical Center.
84,Undefined,0,74,neutral,A dying child was made an honorary fireman by the Phoenix Fire Department.
85,Undefined,0,148,negative,Starbucks recalled 'Collapse into Cool' promotional posters due to complaints that they contained imagery reminiscent of the 9/11 terrorist attacks.
86,Undefined,0,47,negative,'Mob Wives' personality Big Ang died of cancer.
87,Undefined,0,86,positive,Letter suggests fixing the U.S. economy by giving workers over age 50 $1 million each.
88,Undefined,0,68,negative,Video shows U.S. Apache helicopter firing at three Iraqi insurgents.
89,Undefined,0,103,positive,Campbell's Soup will donate a can of soup to the hungry for every click received on a special web page.
90,Undefined,0,94,positive,"Mike Pence supported 'gay conversion' therapy, which involves the use of electroshock therapy."
91,Undefined,0,58,neutral,Actor Jon Voight penned an open letter to President Obama.
92,Undefined,0,76,neutral,The first three digits of a bar code indicate a product's country of origin.
93,Undefined,0,88,positive,Account describes Navy SEALs' funereal tribute to Medal of Honor recipient Mike Monsoor.
94,Undefined,0,81,negative,Essay by J.D. Pendry criticizes foreign policy stances of Democratic politicians.
95,Undefined,0,47,neutral,Photograph shows a Jewish baby stoned by Arabs.
96,Undefined,0,87,positive,Actor Robert De Niro blasted Donald Trump in a video meant to encourage people to vote.
97,Undefined,0,85,neutral,Canadian police are ticketing motorists for parking their cars with the windows down.
98,Undefined,0,99,positive,"As part of the 2009 pre-inaugural festivities, Tiger Woods gave a speech in thanks of the military."
99,Undefined,0,58,negative,Greenies brand dental chews pose a general danger to dogs.
100,Undefined,0,143,neutral,Letter from Indiana state representative accuses the Girl Scouts of being a radicalized organization that promotes abortions and homosexuality.
101,Undefined,0,172,positive,A 14 August 1912 article from a New Zealand newspaper contains a brief story about how burning coal might produce future warming by adding carbon dioxide to the atmosphere.
102,Undefined,0,75,neutral,E-mail presents Bill Brown's assessment of Barack Obama's political record.
103,Undefined,0,172,neutral,"Based on information he learned from library books, school drop-out William Kamkwamba built a windmill out of scrap parts and brought electricity to his village in Malawia."
104,Undefined,0,114,neutral,"Trump's Attorney General pick, Jeff Sessions, blasted a federal law protecting disabled children in the classroom."
105,Undefined,0,55,neutral,Item presents information about the 'real' Mitt Romney.
106,Undefined,0,72,neutral,Text reproduces a statement by President Harry Truman about Republicans.
107,Undefined,0,64,neutral,Photographs show a pair of black and white fraternal twin girls.
108,Undefined,0,102,neutral,Iraqi militant web site displays image of action figure toy identified as a captured American soldier.
109,Undefined,0,107,positive,A provision of 'Obamacare' health care legislation creates a 3.8% Medicare tax on real estate transactions.
110,Undefined,0,96,neutral,Eau Claire schools canceled a planned Veterans Day ceremony over concerns about a 21-gun salute.
111,Undefined,0,107,negative,Criminal gangs in Arlington are staging medical emergencies to lure drivers out of their cars and rob them.
112,Undefined,0,99,negative,EverPet brand dog and cat food is made in China and has caused pets to fall ill and die in the U.S.
113,Undefined,0,86,negative,Insect-infested house is destroyed when too many 'bug bombs' set by owner are ignited.
114,Undefined,0,121,negative,Several on-line airline ticket sites are scams used to harvest credit card numbers or cheat consumers out of their money.
115,Undefined,0,54,negative,Photograph shows a large crocodile killed in Zimbabwe.
116,Undefined,0,88,neutral,Time magazine considering designating Osama bin Laden as its 'Man of the Year' for 2001.
117,Undefined,0,65,neutral,Article explains the difference between http and https protocols.
118,Undefined,0,62,negative,Photograph shows two airliners in dangerously close proximity.
119,Undefined,0,78,negative,A boy named Michael Novenche is undergoing chemotherapy to kill a brain tumor.
120,Undefined,0,93,positive,An Internet-circulated list entitled '2005 Darwin Awards' details actual mishaps and demises.
121,Undefined,0,90,negative,H. L. Mencken wrote that eventually 'the White House will be adorned by a downright moron.
122,Undefined,0,82,positive,The Salt Lake Tribune has endorsed Barack Obama in the 2012 presidential election.
123,Undefined,0,87,positive,Messages provide information about contributions to earthquake relief efforts in Haiti.
124,Undefined,0,118,neutral,"A 'cargo container full of young black women' was found in a port in Savannah, Georgia, 'about to be shipped overseas."
125,Undefined,0,84,positive,President Obama launched an 'African Americans for Obama' campaign in February 2012.
126,Undefined,0,102,neutral,Franchised postal center outlets may charge more than official postal service rates for mailing items.
127,Undefined,0,99,neutral,U.S. Interstate highways are numbered according to a pattern based on their direction and location.
128,Undefined,0,124,negative,"Hurricanes with female names cause more damage because people perceive their risk to be lower, leading to less preparedness."
129,Undefined,0,59,neutral,Video clip shows a wrench being duplicated by a 3D printer.
130,Undefined,0,80,negative,Photographs show a 'censored' protest against a planned mosque in New York City.
131,Undefined,0,106,negative,Officer aboard the USS Abraham Lincoln describes difficulties with ship's humanitarian mission in Sumatra.
132,Undefined,0,91,positive,There are more museums in the United States than McDonald's and Starbucks outlets combined.
133,Undefined,0,91,positive,"Prayers are requested for Heather Brown, who remains in a coma after giving birth to a son."
134,Undefined,0,92,positive,E-mail lists valuable technological innovations brought about by African-American inventors.
135,Undefined,0,35,neutral,Embedded ticks can cause paralysis.
136,Undefined,0,158,positive,A Saudi Arabian newspaper ran an article claiming that Jews use the blood of Christians and Muslims in foods created to celebrate the Jewish holiday of Purim.
137,Undefined,0,75,positive,Image shows 'smart dust' miniaturized RFID technology developed by Hitachi.
138,Undefined,0,156,negative,"No Fear, Inc. a popular retailer, was confused with the National Organization for European American Rights (N.O.F.E.A.R.), a white supremacist organization."
139,Undefined,0,127,negative,Women in Afghanistan are subject to severe violations of basic human rights (but signing a petition isn't likely to help them).
140,Undefined,0,90,negative,"The philosopher Socrates said 'when debate is lost, slander becomes the tool of the loser."
141,Undefined,0,89,negative,The Tim Allen show 'Last Man Standing' was cancelled due to the star's political beliefs.
142,Undefined,0,81,neutral,Article provides information about untapped oil reserves in the Bakken formation.
143,Undefined,0,93,neutral,A newly-elected Muslim Congressman took his oath of office on the Quran instead of the Bible.
144,Undefined,0,106,negative,A child dying of cancer wants you to send him cards so he can get into the Guinness World Book of Records.
145,Undefined,0,123,negative,Michelle Obama visited a Saudi national injured in the Boston Marathon bombings but not an American who lost both his legs.
146,Undefined,0,107,neutral,A Texas woman who cast her vote for all Democratic candidates discovered her ballot marked for Bush/Cheney.
147,Undefined,0,69,neutral,The satirical poem The New School Prayer was penned by a schoolchild.
148,Undefined,0,112,positive,A Pepsi distributor stopped donating supplies to the God's Pit Crew relief agency because of the charity's name.
149,Undefined,0,116,positive,The Obama Event Registry allows users celebrating special occasions to solicit campaign donations in place of gifts.
150,Undefined,0,103,neutral,Macy's offers a 'foreigner's discount' every day but a military discount only 'a couple of days a year.
151,Undefined,0,120,positive,Texting 'FOOD' to 877-877 will give you a nearby location where free meals are available for children during the summer.
152,Undefined,0,87,neutral,Photograph of Michael Jackson's face taken during a court trial is real and undoctored.
153,Undefined,0,56,positive,Dairy Queen is hosting 'Free Cone Day' on 20 March 2017.
154,Undefined,0,90,neutral,"Prayers are requested for Preston Loyd, a 4-year-old boy who was run over by a lawn mower."
155,Undefined,0,54,negative,Editorial criticizes Barack Obama's political stances.
156,Undefined,0,79,neutral,Gospel singer Marvin Sapp is linked to the disappearance of Dr. Teleka Patrick.
157,Undefined,0,94,positive,Incentives received by consumers through the 'Cash for Clunkers' program are subject to taxes.
158,Undefined,0,76,negative,Message warns that health care reform will be a 'death warrant' for seniors.
159,Undefined,0,54,neutral,Photographs show a bizarre-looking baby born in Nepal.
160,Undefined,0,94,positive,Accused Fort Hood shooter Major Nidal Hasan was 'an advisor to Obama's Homeland Security team.
161,Undefined,0,74,negative,Improperly stored or discarded 9-volt batteries can touch off house fires.
162,Undefined,0,86,positive,Photographs show a coyote that survived an eight-hour trip wedged behind a car bumper.
163,Undefined,0,164,negative,"For John Kerry's Labor Day 'front porch' stop in Canonsburg, Pennsylvania, neighborhood streets were closed and residents told to take down their Bush/Cheney signs."
164,Undefined,0,59,neutral,Temporary black henna tattoos can cause permanent scarring.
165,Undefined,0,165,neutral,"A couple rents a video camera and VCR and records themselves engaging in sex, then accidentally leaves the tape in the player when they return it to the video store."
166,Undefined,0,101,negative,Oprah Winfrey is sponsoring a 'New Age Christ' course that contradicts the teachings of Christianity.
167,Undefined,0,164,positive,The Orange County chapter of the American Red Cross declined to allow an invited musical troupe to performs songs such as 'God Bless the USA' at an awards luncheon.
168,Undefined,0,110,negative,Rep. Dick Armey offered a humorous quip about President Clinton's troubles during the Monica Lewinsky scandal.
169,Undefined,0,132,negative,Women in a dangerous situation at a bar can order an angel shot to ensure safe passage into an Uber and away from a frightening man.
170,Undefined,0,81,negative,"Prayers are requested for Audri King, a 2-year-old Oklahoma girl battling cancer."
171,Undefined,0,87,negative,A New York high school has forced students to recite the Pledge of Allegiance in Arabic
172,Undefined,0,100,neutral,"Various rumors connected with the shootings at Sandy Hook Elementary School in Newtown, Connecticut."
173,Undefined,0,155,positive,Seventh graders in California are subjected to an intense three-week course in Islam in which they are required to pray to Allah and memorize Koran verses.
174,Undefined,0,119,negative,Journalist Geraldo Rivera commented (regarding the war in Iraq) that 'reporters don't report buildings that don't burn.
175,Undefined,0,118,neutral,Letter to AARP from owners of Miller Farms Equine Transport explains their reasons for not renewing their memberships.
176,Undefined,0,93,positive,"A new study determined that hot dogs contain human DNA, and vegetarian versions contain meat."
177,Undefined,0,79,negative,Photographs show an angry elephant overturning an automobile in a game reserve.
178,Undefined,0,93,negative,A 2-month-old girl was badly burned in the hand by emergency room staff at a Merced hospital.
179,Undefined,0,152,negative,"Administering three simple tests will help diagnose a stroke, and pricking a stroke victim's fingers will prevent further harm from the cerebral attack."
180,Undefined,0,104,neutral,Various states have passed laws requiring that public assistance recipients pass a drug testing program.
181,Undefined,0,69,neutral,E-mail offers sniper-avoidance tips from an experienced 'SWAT sniper.
182,Undefined,0,138,neutral,A photograh showing a body of water with two distinct colors is a permanent location where the Mississippi River meets the Gulf Of Mexico.
183,Undefined,0,78,positive,Outdoor temperature can be determined by counting the chirps made by crickets.
184,Undefined,0,96,neutral,A constitutional law professor quipped on the difference between the Bible and the Constitution.
185,Undefined,0,67,neutral,Pepsi is test marketing a Doritos-flavored version of Mountain Dew.
186,Undefined,0,84,positive,Target has banned use of the phrase 'Merry Christmas' in its stores and advertising.
187,Undefined,0,60,negative,Chicken jerky treats from China are causing illness in pets.
188,Undefined,0,170,negative,"In 1969, comic Red Skelton lamented on his weekly television show that the Pledge of Allegiance might someday be considered a 'prayer' and eliminated from public schools."
189,Undefined,0,106,neutral,Various Internet-circulated items about the 2008 U.S. presidential election were written by Thomas Sowell.
190,Undefined,0,86,negative,"Students in Revere, Massachusetts, were forced to recite an Islamic conversion prayer."
191,Undefined,0,90,neutral,Magazine cover photo shows former Olympian Bruce Jenner transitioning to becoming a woman.
192,Undefined,0,61,positive,A prominent meteor shower will be visible in late April 2013.
193,Undefined,0,104,neutral,Kay Arthur warned a conference that 'God had revealed to her that a literal famine is coming to America.
194,Undefined,0,80,negative,Mr. Rogers' car was returned after the thieves who stole it realized it was his.
195,Undefined,0,56,neutral,Photograph shows a mud puddle in the shape of Australia.
196,Undefined,0,92,negative,"Malls are fining store owners $1,100 for every hour they refuse to open on Thanksgiving Day."
197,Undefined,0,61,neutral,Photographs show an unusually colored buck taken by a hunter.
198,Undefined,0,99,negative,Florida motorists can block the DMV from disclosing their motor vehicle and driver license records.
199,Undefined,0,98,positive,The Best Buy chain is eschewing use of the word 'Christmas' in its 2006 holiday print advertising.
200,Undefined,0,86,negative,President Obama refused to participate in the ALS Association's 'Ice Bucket Challenge.
